{
  "schemaVersion": "1.0.0",
  "id": "evt_000000000000000000000005",
  "commandId": "cmd_000000000000000000000001",
  "type": "command.lifecycle.transition",
  "timestamp": "2026-06-23T16:00:00.050Z",
  "previousStatus": "running",
  "currentStatus": "succeeded",
  "message": "Command completed.",
  "error": null
}
