{
  "schemaVersion": "1.0.0",
  "id": "evt_000000000000000000000001",
  "commandId": "cmd_000000000000000000000001",
  "type": "command.lifecycle.transition",
  "timestamp": "2026-06-23T16:00:00.010Z",
  "previousStatus": null,
  "currentStatus": "received",
  "message": "Command received.",
  "error": null
}
