{
  "schemaVersion": "1.0.0",
  "id": "evt_000000000000000000000009",
  "commandId": "cmd_000000000000000000000011",
  "type": "command.lifecycle.transition",
  "timestamp": "2026-06-23T16:00:12.000Z",
  "previousStatus": "running",
  "currentStatus": "cancelled",
  "message": "Command cancelled during execution.",
  "error": {
    "code": "command_cancelled",
    "category": "cancelled",
    "message": "The command was cancelled before completion.",
    "details": {},
    "remediation": null
  }
}
