{
  "schemaVersion": "1.0.0",
  "id": "evt_000000000000000000000002",
  "commandId": "cmd_000000000000000000000001",
  "type": "command.lifecycle.transition",
  "timestamp": "2026-06-23T16:00:00.020Z",
  "previousStatus": "received",
  "currentStatus": "planned",
  "message": "Mode plan prepared.",
  "error": null
}
